Customer,Email,Phone,Food_Name,Food_Description,History
Dominic Rodriguez,DominicRodriguez@gmail.com,555-123-4649,Caprese Salad,"An Italian salad made with fresh tomatoes, mozzarella cheese, basil leaves, olive oil, and balsamic vinegar.","Tiramisu, Bibingka, Kabsa, Pupusas, Bakso, Haggis, Fufu, Dolma, Banh Mi, Rösti"
Madelyn Patel,MadelynPatel@gmail.com,555-123-4650,Chicken Parmesan,"Breaded and fried chicken cutlets topped with marinara sauce and melted cheese, often served with pasta.","Gumbo, Pierogi, Fish and Chips, Jambalaya, Chicken Tikka Masala, Arepas, Sauerbraten, Falafel, Tiramisu, Bibingka"
Hunter Gupta,HunterGupta@gmail.com,555-123-4651,Beef Bourguignon,"A classic French beef stew cooked with red wine, mushrooms, onions, and bacon.","Croissant, Kimchi, Baklava, Empanadas, Goulash, Dim Sum, Biryani, Wiener Schnitzel, Pirozhki, Ceviche"
Camila Shah,CamilaShah@gmail.com,555-123-4652,Eggs Benedict,A breakfast dish consisting of poached eggs served on toasted English muffins with ham or bacon and hollandaise sauce.,"Bibimbap, Fajitas, Kebab, Rendang, Couscous, Lobster Roll, Cannoli, Peking Duck, Gumbo, Pierogi"
Owen Brown,OwenBrown@gmail.com,555-123-4653,Cinnamon Rolls,"Sweet rolls filled with cinnamon sugar and topped with icing, a popular breakfast treat.","Fish and Chips, Jambalaya, Chicken Tikka Masala, Arepas, Sauerbraten, Falafel, Tiramisu, Bibingka, Kabsa, Pupusas"
Addison Ali,AddisonAli@gmail.com,555-123-4654,Lobster Bisque,"A rich and creamy soup made with lobster meat, broth, cream, and seasonings.","Haggis, Fufu, Dolma, Banh Mi, Rösti, Jollof Rice, Shakshuka, Pancakes, Cacio e Pepe, Stroopwafel"
Connor Nguyen,ConnorNguyen@gmail.com,555-123-4655,Clam Chowder,"A creamy soup made with clams, potatoes, onions, and celery, often served with crackers or crusty bread.","Chicken Adobo, Gazpacho, Katsu Curry, Lechon, Lomo Saltado, Currywurst, Sashimi, Moules Frites, Shawarma, Pierogi"
Kinsley Patel,KinsleyPatel@gmail.com,555-123-4656,Chicken Fried Rice,"Stir-fried rice with chicken, eggs, vegetables, and soy sauce, a popular dish in Chinese cuisine.","Escargot, Ramen, Frittata, Lobster Thermidor, Masala Dosa, Gallo Pinto, Tempura, Chimichanga, Sauerbraten, Ravioli"
Josiah Sharma,JosiahSharma@gmail.com,555-123-4657,Macaroni and Cheese,"A classic American comfort food dish made with cooked macaroni pasta and a cheesy sauce, often baked until bubbly and golden brown.","Chicken Satay, Tzatziki, Tempura, Creme Brulee, Scones, Beef Stroganoff, Guacamole, Nachos, Caprese Salad, Chicken Parmesan"
Juliette Lee,JulietteLee@gmail.com,555-123-4658,Pecan Pie,"A pie made with a filling of pecans, sugar, butter, and eggs, often served with whipped cream or ice cream.","Beef Bourguignon, Eggs Benedict, Cinnamon Rolls, Lobster Bisque, Clam Chowder, Chicken Fried Rice, Macaroni and Cheese, Pecan Pie, Apple Strudel, Beef Wellington"
Levi Martin,LeviMartin@gmail.com,555-123-4659,Apple Strudel,"A traditional Austrian pastry made with thin layers of dough filled with spiced apples, raisins, and nuts, typically served with vanilla sauce or ice cream.","Baklava, Pad See Ew, Chicken Satay, Tzatziki, Tempura, Creme Brulee, Scones, Beef Stroganoff, Guacamole, Nachos"
Astrid Mardo,AstridMardo@gmail.com,555-123-4660,Beef Welington,"A dish of tender beef fillet coated with pâté and mushroom duxelles, wrapped in puff pastry and baked until golden brown.","Caprese Salad, Chicken Parmesan, Beef Bourguignon, Eggs Benedict, Cinnamon Rolls, Lobster Bisque, Clam Chowder, Chicken Fried Rice, Macaroni and Cheese, Pecan Pie"
